{
  "$schema": "warrant://waiver/1",
  "id": "WAV-01M3YC8FP9SYPK438EKXFQS4TX",
  "change": "orders-currency-migration",
  "gate": "reconciliation-passed",
  "reason": "Historical source snapshot unavailable.",
  "risk": "MEDIUM",
  "compensating_controls": [
    "consumer-validation",
    "post-release-monitoring"
  ],
  "owner": "data-platform-owner",
  "expires_at": "2026-10-15",
  "waiver_state": "PROPOSED"
}
