{
  "$schema": "warrant://waiver/1",
  "id": "WAV-2026-001",
  "change": "phase-3-verification",
  "gate": "analyze-clean",
  "reason": "warrant analyze is not implemented in phase 3: analyze-clean has no producer and stays BLOCKED/NO_INPUT until phase 4.",
  "risk": "HIGH",
  "compensating_controls": [
    "phase-4 change implements the producer",
    "maintainer review of PR"
  ],
  "owner": "human:Homasters-max",
  "approved_by": "human:Homasters-max",
  "expires_at": "2026-12-31",
  "waiver_state": "ACTIVE"
}
